{
  "schema_version": 1,
  "generated_at": "2026-08-02T18:42:22+02:00",
  "generator": "tools/fb-events",
  "candidates": [
    {
      "id": "fb-890967630480039",
      "title": "Letní barokní scéna – Martin Málek, vernisáž výstavy Spojení v naději",
      "date_text": "Pá, 14. 8. v 17:00 CEST",
      "start_at": "2026-08-14T17:00:00+02:00",
      "end_at": null,
      "all_day": false,
      "ongoing": false,
      "municipality": "Chrudim",
      "venue": "Museum of Baroque Chrudim Muzeum baroka",
      "address": "Školní náměstí 11, 537 01 Chrudim, Česko",
      "discovered_at": "2026-08-02T18:20:50+02:00",
      "discovery_method": "facebook",
      "discovery_scope": "priority-14-days",
      "source_url": "https://www.facebook.com/events/890967630480039/",
      "facebook_event_id": "890967630480039",
      "facebook_page": "Chrudimskabeseda",
      "facebook_public": true,
      "source_id": "chrudimska-beseda",
      "region": "pardubicky-kraj",
      "district": "Chrudim",
      "organizers": [
        "Chrudimská beseda, městské kulturní středisko"
      ],
      "price_text": null,
      "requires_primary_source": true,
      "candidate_kind": "single-event",
      "programme_id": null,
      "programme_title": null,
      "expandable": false,
      "facebook_time_ids": [],
      "status": "needs-verification",
      "notes": "Geoznačka Facebooku uvádí obec „Chrudim“ — ověřit. Vstupné Facebook nenabízí strukturovaně, ověřit u pořadatele."
    },
    {
      "id": "fb-1604923597719412",
      "title": "Rodinná anamnéza – komentovaná prohlídka výstavy",
      "date_text": "So, 15. 8. v 15:00 CEST",
      "start_at": "2026-08-15T15:00:00+02:00",
      "end_at": null,
      "all_day": false,
      "ongoing": false,
      "municipality": "Kočí",
      "venue": "Výstavní síň Chrudim - Divadlo Karla Pippicha",
      "address": "Resselovo náměstí, 537 01 Chrudim, Česko",
      "discovered_at": "2026-08-02T18:20:50+02:00",
      "discovery_method": "facebook",
      "discovery_scope": "priority-14-days",
      "source_url": "https://www.facebook.com/events/1604923597719412/",
      "facebook_event_id": "1604923597719412",
      "facebook_page": "Chrudimskabeseda",
      "facebook_public": true,
      "source_id": "chrudimska-beseda",
      "region": "pardubicky-kraj",
      "district": "Chrudim",
      "organizers": [
        "Chrudimská beseda, městské kulturní středisko",
        "Výstavní síň Chrudim - Divadlo Karla Pippicha"
      ],
      "price_text": null,
      "requires_primary_source": true,
      "candidate_kind": "single-event",
      "programme_id": null,
      "programme_title": null,
      "expandable": false,
      "facebook_time_ids": [],
      "status": "needs-verification",
      "notes": "Geoznačka Facebooku uvádí obec „Kočí“ — ověřit. Vstupné Facebook nenabízí strukturovaně, ověřit u pořadatele."
    },
    {
      "id": "fb-2412285059248213",
      "title": "Letní barokní scéna – Alessandro Melani: Il fratricidio di Caino",
      "date_text": "So, 15. 8. v 20:00 CEST",
      "start_at": "2026-08-15T20:00:00+02:00",
      "end_at": null,
      "all_day": false,
      "ongoing": false,
      "municipality": null,
      "venue": null,
      "address": "Resselovo náměstí, 537 01 Chrudim, Česko",
      "discovered_at": "2026-08-02T18:20:50+02:00",
      "discovery_method": "facebook",
      "discovery_scope": "priority-14-days",
      "source_url": "https://www.facebook.com/events/2412285059248213/",
      "facebook_event_id": "2412285059248213",
      "facebook_page": "Chrudimskabeseda",
      "facebook_public": true,
      "source_id": "chrudimska-beseda",
      "region": "pardubicky-kraj",
      "district": "Chrudim",
      "organizers": [
        "Chrudimská beseda, městské kulturní středisko"
      ],
      "price_text": null,
      "requires_primary_source": true,
      "candidate_kind": "single-event",
      "programme_id": null,
      "programme_title": null,
      "expandable": false,
      "facebook_time_ids": [],
      "status": "needs-verification",
      "notes": "Facebook neuvedl místo konání. Facebook neuvedl obec. Vstupné Facebook nenabízí strukturovaně, ověřit u pořadatele."
    },
    {
      "id": "fb-4525215647723357",
      "title": "Letní barokní scéna – Alessandro Melani: Il fratricidio di Caino",
      "date_text": "So, 15. 8. v 20:00 CEST",
      "start_at": "2026-08-15T20:00:00+02:00",
      "end_at": null,
      "all_day": false,
      "ongoing": false,
      "municipality": null,
      "venue": null,
      "address": "Resselovo náměstí, 537 01 Chrudim, Česko",
      "discovered_at": "2026-08-02T18:20:50+02:00",
      "discovery_method": "facebook",
      "discovery_scope": "priority-14-days",
      "source_url": "https://www.facebook.com/events/4525215647723357/",
      "facebook_event_id": "4525215647723357",
      "facebook_page": "Chrudimskabeseda",
      "facebook_public": true,
      "source_id": "chrudimska-beseda",
      "region": "pardubicky-kraj",
      "district": "Chrudim",
      "organizers": [
        "Chrudimská beseda, městské kulturní středisko"
      ],
      "price_text": null,
      "requires_primary_source": true,
      "candidate_kind": "single-event",
      "programme_id": null,
      "programme_title": null,
      "expandable": false,
      "facebook_time_ids": [],
      "status": "needs-verification",
      "notes": "Facebook neuvedl místo konání. Facebook neuvedl obec. Vstupné Facebook nenabízí strukturovaně, ověřit u pořadatele. Pozor: stejný název i čas jako fb-2412285059248213 — možná duplicita přímo na Facebooku."
    },
    {
      "id": "fb-1703561007456668",
      "title": "Letní barokní scéna – La Dafne",
      "date_text": "Ne, 16. 8. v 20:00 CEST",
      "start_at": "2026-08-16T20:00:00+02:00",
      "end_at": null,
      "all_day": false,
      "ongoing": false,
      "municipality": "Chrudim",
      "venue": "Museum of Baroque Chrudim Muzeum baroka",
      "address": "Školní náměstí 11, 537 01 Chrudim, Česko",
      "discovered_at": "2026-08-02T18:20:50+02:00",
      "discovery_method": "facebook",
      "discovery_scope": "priority-14-days",
      "source_url": "https://www.facebook.com/events/1703561007456668/",
      "facebook_event_id": "1703561007456668",
      "facebook_page": "Chrudimskabeseda",
      "facebook_public": true,
      "source_id": "chrudimska-beseda",
      "region": "pardubicky-kraj",
      "district": "Chrudim",
      "organizers": [
        "Chrudimská beseda, městské kulturní středisko",
        "Museum of Baroque Chrudim Muzeum baroka"
      ],
      "price_text": null,
      "requires_primary_source": true,
      "candidate_kind": "single-event",
      "programme_id": null,
      "programme_title": null,
      "expandable": false,
      "facebook_time_ids": [],
      "status": "needs-verification",
      "notes": "Geoznačka Facebooku uvádí obec „Chrudim“ — ověřit. Vstupné Facebook nenabízí strukturovaně, ověřit u pořadatele."
    },
    {
      "id": "fb-1833948394246272",
      "title": "Filmová noc na Báře – Cukrkandl",
      "date_text": "Pá, 21. 8. v 21:00 CEST",
      "start_at": "2026-08-21T21:00:00+02:00",
      "end_at": null,
      "all_day": false,
      "ongoing": false,
      "municipality": "Chrudim",
      "venue": "Rozhledna Bára",
      "address": "Chrudim III ev. č. 300, 538 21 Chrudim, Česko",
      "discovered_at": "2026-08-02T18:20:50+02:00",
      "discovery_method": "facebook",
      "discovery_scope": "opportunistic-future",
      "source_url": "https://www.facebook.com/events/1833948394246272/",
      "facebook_event_id": "1833948394246272",
      "facebook_page": "Chrudimskabeseda",
      "facebook_public": true,
      "source_id": "chrudimska-beseda",
      "region": "pardubicky-kraj",
      "district": "Chrudim",
      "organizers": [
        "Chrudimská beseda, městské kulturní středisko"
      ],
      "price_text": null,
      "requires_primary_source": true,
      "candidate_kind": "single-event",
      "programme_id": null,
      "programme_title": null,
      "expandable": false,
      "facebook_time_ids": [],
      "status": "needs-verification",
      "notes": "Geoznačka Facebooku uvádí obec „Chrudim“ — ověřit. Vstupné Facebook nenabízí strukturovaně, ověřit u pořadatele."
    },
    {
      "id": "fb-2127934741274139",
      "title": "Filmové noci na rozhledně BÁRA",
      "date_text": "Pá, 21. 8. – 22. 8.",
      "start_at": "2026-08-21T00:00:00+02:00",
      "end_at": "2026-08-22T23:00:00+02:00",
      "all_day": true,
      "ongoing": false,
      "municipality": "Chrudim",
      "venue": "Rozhledna Bára",
      "address": "Chrudim III ev. č. 300, 538 21 Chrudim, Česko",
      "discovered_at": "2026-08-02T18:20:50+02:00",
      "discovery_method": "facebook",
      "discovery_scope": "opportunistic-future",
      "source_url": "https://www.facebook.com/events/2127934741274139/",
      "facebook_event_id": "2127934741274139",
      "facebook_page": "Chrudimskabeseda",
      "facebook_public": true,
      "source_id": "chrudimska-beseda",
      "region": "pardubicky-kraj",
      "district": "Chrudim",
      "organizers": [
        "Rekreační lesy Podhůra",
        "Chrudimská beseda, městské kulturní středisko"
      ],
      "price_text": null,
      "requires_primary_source": true,
      "candidate_kind": "single-event",
      "programme_id": null,
      "programme_title": null,
      "expandable": false,
      "facebook_time_ids": [],
      "status": "needs-verification",
      "notes": "Geoznačka Facebooku uvádí obec „Chrudim“ — ověřit. Vstupné Facebook nenabízí strukturovaně, ověřit u pořadatele."
    },
    {
      "id": "fb-1573112861263154",
      "title": "Filmová noc na Báře – Nečekané léto",
      "date_text": "So, 22. 8. v 21:00 CEST",
      "start_at": "2026-08-22T21:00:00+02:00",
      "end_at": null,
      "all_day": false,
      "ongoing": false,
      "municipality": "Chrudim",
      "venue": "Rozhledna Bára",
      "address": null,